{
  "schema_version": 1,
  "id": "network-unavailable",
  "domain": "network",
  "condition": "unavailable",
  "title": "Network connectivity is unavailable",
  "severity": "critical",
  "expected_status": "error",
  "requires_admin": true,
  "offline_safe": false,
  "signals": [
    "Network connectivity reports unavailable."
  ],
  "operator_steps": [
    "Open Recovery & settings and confirm the affected status.",
    "Pause new work that depends on this capability."
  ],
  "admin_steps": [
    "Use the protected recovery control for this capability once."
  ],
  "success_criteria": [
    "Network connectivity reports available and a read-only check succeeds."
  ],
  "tags": [
    "continuity",
    "network",
    "unavailable",
    "critical"
  ]
}
