{
  "schema_version": 1,
  "id": "thermal-intermittent",
  "domain": "thermal",
  "condition": "intermittent",
  "title": "Thermal state is intermittent",
  "severity": "warning",
  "expected_status": "warning",
  "requires_admin": false,
  "offline_safe": true,
  "signals": [
    "Thermal state changes repeatedly between healthy and unavailable."
  ],
  "operator_steps": [
    "Record the time and support code when the state changes.",
    "Do not repeat a write when the prior result is unknown."
  ],
  "admin_steps": [],
  "success_criteria": [
    "Thermal state remains healthy through three consecutive checks."
  ],
  "tags": [
    "continuity",
    "thermal",
    "intermittent",
    "warning"
  ]
}
