{
  "schema_version": 1,
  "id": "network-unsafe-state",
  "domain": "network",
  "condition": "unsafe-state",
  "title": "Network connectivity is in an unsafe state",
  "severity": "critical",
  "expected_status": "error",
  "requires_admin": true,
  "offline_safe": false,
  "signals": [
    "Network connectivity cannot confirm whether the last operation completed safely."
  ],
  "operator_steps": [
    "Stop using the affected capability immediately.",
    "Do not repeat or reverse the unknown operation."
  ],
  "admin_steps": [
    "Isolate the capability and escalate before restoring service."
  ],
  "success_criteria": [
    "Network connectivity has a verified state and passes a non-destructive check."
  ],
  "tags": [
    "continuity",
    "network",
    "unsafe-state",
    "critical"
  ]
}
