{
  "schema_version": 1,
  "id": "audio-unavailable",
  "domain": "audio",
  "condition": "unavailable",
  "title": "Audio output is unavailable",
  "severity": "critical",
  "expected_status": "error",
  "requires_admin": true,
  "offline_safe": false,
  "signals": [
    "Audio output reports unavailable."
  ],
  "operator_steps": [
    "Open Recovery & settings and confirm the affected status.",
    "Pause new work that depends on this capability."
  ],
  "admin_steps": [
    "Use the protected recovery control for this capability once."
  ],
  "success_criteria": [
    "Audio output reports available and a read-only check succeeds."
  ],
  "tags": [
    "continuity",
    "audio",
    "unavailable",
    "critical"
  ]
}
