{
  "schema_version": 1,
  "id": "storage-misconfigured",
  "domain": "storage",
  "condition": "misconfigured",
  "title": "Local storage is misconfigured",
  "severity": "error",
  "expected_status": "error",
  "requires_admin": true,
  "offline_safe": false,
  "signals": [
    "Local storage reports configuration that cannot be applied."
  ],
  "operator_steps": [
    "Capture the visible error and support code.",
    "Avoid changing unrelated settings."
  ],
  "admin_steps": [
    "Correct only the validated setting, then save once."
  ],
  "success_criteria": [
    "Local storage accepts configuration and returns to healthy."
  ],
  "tags": [
    "continuity",
    "storage",
    "misconfigured",
    "error"
  ]
}
