{
  "schema_version": 1,
  "id": "dns-timeout",
  "domain": "dns",
  "condition": "timeout",
  "title": "Name resolution times out",
  "severity": "warning",
  "expected_status": "warning",
  "requires_admin": false,
  "offline_safe": false,
  "signals": [
    "Name resolution does not complete within the expected interval."
  ],
  "operator_steps": [
    "Wait for a definitive result before attempting another action.",
    "Open status and confirm whether the dependency is still active."
  ],
  "admin_steps": [],
  "success_criteria": [
    "Name resolution completes within the expected interval twice."
  ],
  "tags": [
    "continuity",
    "dns",
    "timeout",
    "warning"
  ]
}
