{
  "schema_version": 1,
  "id": "keyboard-healthy-baseline",
  "domain": "keyboard",
  "condition": "healthy-baseline",
  "title": "Keyboard input meets its healthy baseline",
  "severity": "info",
  "expected_status": "ok",
  "requires_admin": false,
  "offline_safe": true,
  "signals": [
    "Keyboard input reports healthy with no active warning."
  ],
  "operator_steps": [
    "Confirm the health summary is understandable at a glance.",
    "Continue normal work without opening protected controls."
  ],
  "admin_steps": [],
  "success_criteria": [
    "Keyboard input remains healthy after an ordinary refresh."
  ],
  "tags": [
    "continuity",
    "keyboard",
    "healthy-baseline",
    "info"
  ]
}
