{
  "schema_version": 1,
  "id": "installer-intermittent",
  "domain": "installer",
  "condition": "intermittent",
  "title": "Installer is intermittent",
  "severity": "warning",
  "expected_status": "warning",
  "requires_admin": false,
  "offline_safe": false,
  "signals": [
    "Installer changes repeatedly between healthy and unavailable."
  ],
  "operator_steps": [
    "Record the time and support code when the state changes.",
    "Do not repeat a write when the prior result is unknown."
  ],
  "admin_steps": [],
  "success_criteria": [
    "Installer remains healthy through three consecutive checks."
  ],
  "tags": [
    "continuity",
    "installer",
    "intermittent",
    "warning"
  ]
}
