{
  "schema_version": 1,
  "id": "audio-misconfigured",
  "domain": "audio",
  "condition": "misconfigured",
  "title": "Audio output is misconfigured",
  "severity": "error",
  "expected_status": "error",
  "requires_admin": true,
  "offline_safe": false,
  "signals": [
    "Audio output reports configuration that cannot be applied."
  ],
  "operator_steps": [
    "Capture the visible error and support code.",
    "Avoid changing unrelated settings."
  ],
  "admin_steps": [
    "Correct only the validated setting, then save once."
  ],
  "success_criteria": [
    "Audio output accepts configuration and returns to healthy."
  ],
  "tags": [
    "continuity",
    "audio",
    "misconfigured",
    "error"
  ]
}
