{
  "schema_version": 1,
  "id": "mouse-timeout",
  "domain": "mouse",
  "condition": "timeout",
  "title": "Pointer input times out",
  "severity": "warning",
  "expected_status": "warning",
  "requires_admin": false,
  "offline_safe": true,
  "signals": [
    "Pointer input does not complete within the expected interval."
  ],
  "operator_steps": [
    "Wait for a definitive result before attempting another action.",
    "Open status and confirm whether the dependency is still active."
  ],
  "admin_steps": [],
  "success_criteria": [
    "Pointer input completes within the expected interval twice."
  ],
  "tags": [
    "continuity",
    "mouse",
    "timeout",
    "warning"
  ]
}
