{
  "schema_version": 1,
  "id": "boot-degraded",
  "domain": "boot",
  "condition": "degraded",
  "title": "Boot process is degraded",
  "severity": "warning",
  "expected_status": "warning",
  "requires_admin": false,
  "offline_safe": true,
  "signals": [
    "Boot process reports degraded service."
  ],
  "operator_steps": [
    "Finish only the current safe action before opening status.",
    "Use an unaffected workflow until the warning clears."
  ],
  "admin_steps": [],
  "success_criteria": [
    "Boot process returns to healthy without a new warning."
  ],
  "tags": [
    "continuity",
    "boot",
    "degraded",
    "warning"
  ]
}
